{
  "$schema": "https://json-schema.org/draft/2020-12/schema",
  "$id": "blessed/public-download-manifest/v1",
  "title": "Public download surface manifest",
  "description": "The SURFACE manifest for one release: where the validated bytes are public. Authored by the SURFACE OWNER, not the producer, and deliberately distinct from the producer's signed candidate envelope (release-candidate.json + release-candidate.json.sig), which stays published under its own name with its original signature. This document is the projection: it carries canonical public URLs, surface id and channel context, which the producer cannot know because it does not own the surface. It MAY NOT alter artifact hashes or identities — every asset here must match the admitted candidate exactly — and it is not itself signed, so a consumer's trust in it comes from the applier having bound it to a signature-verified candidate and to the publication evidence before the channel pointer was allowed to advance. Schema written from the format ALREADY PUBLISHED at docsort.io.",
  "type": "object",
  "additionalProperties": false,
  "required": ["schema", "project", "tag", "version", "channel", "release", "candidate", "assets"],
  "properties": {
    "schema": { "const": "blessed/public-download-manifest/v1" },
    "project": { "type": "string", "minLength": 1 },
    "tag": { "type": "string", "minLength": 1 },
    "version": { "type": "string", "minLength": 1 },
    "channel": { "type": "string", "minLength": 1 },
    "release": {
      "type": "object",
      "additionalProperties": false,
      "required": ["name", "notes_markdown_url", "published_at"],
      "properties": {
        "name": { "type": "string", "minLength": 1 },
        "notes_markdown_url": { "type": "string", "format": "uri", "pattern": "^https://" },
        "published_at": {
          "description": "Release publication time, carried verbatim from the Release receipt. NOT the candidate's created_at, which records when the candidate was built from its source commit.",
          "type": "string",
          "format": "date-time"
        }
      }
    },
    "candidate": {
      "description": "Identifies the producer's signed envelope this projection was derived from. manifest_url names release-candidate.json — the envelope — NOT this document.",
      "type": "object",
      "additionalProperties": false,
      "required": ["manifest_sha256", "manifest_url", "signing_key_id", "source_sha"],
      "properties": {
        "manifest_sha256": { "type": "string", "pattern": "^[0-9a-f]{64}$" },
        "manifest_url": { "type": "string", "format": "uri", "pattern": "^https://" },
        "signing_key_id": { "type": "string", "minLength": 1 },
        "source_sha": { "type": "string", "pattern": "^[0-9a-f]{40}$" }
      }
    },
    "assets": {
      "type": "array",
      "minItems": 1,
      "items": {
        "type": "object",
        "additionalProperties": false,
        "required": ["filename", "id", "install_kind", "platform", "sha256", "size_bytes", "url"],
        "properties": {
          "filename": { "type": "string", "minLength": 1 },
          "id": { "type": "string", "minLength": 1 },
          "install_kind": { "type": "string", "minLength": 1 },
          "platform": { "type": "string", "pattern": "^(any|[a-z0-9]+/[a-z0-9_]+)$" },
          "sha256": { "type": "string", "pattern": "^[0-9a-f]{64}$" },
          "size_bytes": { "type": "integer", "minimum": 0 },
          "url": { "type": "string", "format": "uri", "pattern": "^https://" }
        }
      }
    }
  }
}
